Source Title,Language,Title,Body,Image,Video,Interests
Skydiving over the Caribbean,es,Paracaidismo sobre el Caribe,"En un lugar de la Mancha, de cuyo nombre no quiero acordarme, no ha mucho tiempo que vivía un hidalgo de los de lanza en astillero, adarga antigua, rocín flaco y galgo corredor. Una olla de algo más vaca que carnero, salpicón las más noches, duelos y quebrantos los sábados, lantejas los viernes, algún palomino de añadidura los domingos, consumían las tres partes de su hacienda. El resto della concluían sayo de velarte, calzas de velludo para las fiestas, con sus pantuflos de lo mesmo, y los días de entresemana se honraba con su vellorí de lo más fino. Tenía en su casa una ama que pasaba de los cuarenta, y una sobrina que no llegaba a los veinte, y un mozo de campo y plaza, que así ensillaba el rocín como tomaba la podadera.",belize-air.jpg,http://www.youtube.com/watch?v=jmZ0fJC5lwQ,"Adventure, Tropical, Vacation"
Hiking Belize Forest,es,Senderismo Forestal de Belice,"Es, pues, de saber que este sobredicho hidalgo, los ratos que estaba ocioso, que eran los más del año, se daba a leer libros de caballerías, con tanta afición y gusto, que olvidó casi de todo punto el ejercicio de la caza, y aun la administración de su hacienda. Y llegó a tanto su curiosidad y desatino en esto, que vendió muchas hanegas de tierra de sembradura para comprar libros de caballerías en que leer, y así, llevó a su casa todos cuantos pudo haber dellos; y de todos, ningunos le parecían tan bien como los que compuso el famoso Feliciano de Silva, porque la claridad de su prosa y aquellas entricadas razones suyas le parecían de perlas, y más cuando llegaba a leer aquellos requiebros y cartas.",belize-forest.jpg,http://www.youtube.com/watch?v=t5v11F34PN4,"Adventure, Tropical, Vacation, Gym"
Free London Transit Apps,es,Aplicaciones gratis Tránsito Londres,"Con estas razones perdía el pobre caballero el juicio, y desvelábase por entenderlas y desentrañarles el sentido, que no se lo sacara ni las entendiera el mesmo Aristóteles, si resucitara para sólo ello. No estaba muy bien con las heridas que don Belianís daba y recebía, porque se imaginaba que, por grandes maestros que le hubiesen curado, no dejaría de tener el rostro y todo el cuerpo lleno de cicatrices y señales. Pero, con todo, alababa en su autor aquel acabar su libro con la promesa de aquella inacabable aventura, y muchas veces le vino deseo de tomar la pluma y dalle fin al pie de la letra, como allí se promete; y sin duda alguna lo hiciera, y aun saliera con ello, si otros mayores y continuos pensamientos no se lo estorbaran.",london-traffic.jpg,http://www.youtube.com/watch?v=qwAn7Y83NzU,"Business, Europe, UK, Free Wifi, Dining, Bar"
Explore Lost Civilizations,es,Explora Lost Civilizations,"En resolución, él se enfrascó tanto en su letura, que se le pasaban las noches leyendo de claro en claro, y los días de turbio en turbio; y así, del poco dormir y del mucho leer, se le secó el celebro, de manera que vino a perder el juicio. Llenósele la fantasía de todo aquello que leía en los libros, así de encantamentos como de pendencias, batallas, desafíos, heridas, requiebros, amores, tormentas y disparates imposibles; y asentósele de tal modo en la imaginación que era verdad toda aquella máquina de aquellas sonadas soñadas invenciones que leía, que para él no había otra historia más cierta en el mundo. Decía él que el Cid Ruy Díaz había sido muy buen caballero, pero que no tenía que ver con el Caballero de la Ardiente Espada.",belize-ruins.jpg,http://www.youtube.com/watch?v=Q4wbBmsga1U,"Tropical, Vacation, Adventure"
Island Vacation Getaways,es,Island Vacation Escapadas,"En efeto, rematado ya su juicio, vino a dar en el más estraño pensamiento que jamás dio loco en el mundo; y fue que le pareció convenible y necesario, así para el aumento de su honra como para el servicio de su república, hacerse caballero andante, y irse por todo el mundo con sus armas y caballo a buscar las aventuras y a ejercitarse en todo aquello que él había leído que los caballeros andantes se ejercitaban, deshaciendo todo género de agravio, y poniéndose en ocasiones y peligros donde, acabándolos, cobrase eterno nombre y fama. Imaginábase el pobre ya coronado por el valor de su brazo, por lo menos, del imperio de Trapisonda; y así, con estos tan agradables pensamientos, llevado del estraño gusto que en ellos sentía, se dio priesa a poner en efeto lo que deseaba.",belize-island.jpg,http://www.youtube.com/watch?v=5i_XY2amDwc,"Tropical, Vacation, Bar, Spa, Dining, Gym"
London Attractions Itinerary,es,Londres Qué Itinerario,"Y lo primero que hizo fue limpiar unas armas que habían sido de sus bisabuelos, que, tomadas de orín y llenas de moho, luengos siglos había que estaban puestas y olvidadas en un rincón. Limpiólas y aderezólas lo mejor que pudo, pero vio que tenían una gran falta, y era que no tenían celada de encaje, sino morrión simple; mas a esto suplió su industria, porque de cartones hizo un modo de media celada, que, encajada con el morrión, hacían una apariencia de celada entera. Es verdad que para probar si era fuerte y podía estar al riesgo de una cuchillada, sacó su espada y le dio dos golpes, y con el primero y en un punto deshizo lo que había hecho en una semana; y no dejó de parecerle mal la facilidad con que la había hecho pedazos.",london-castle.jpg,http://www.youtube.com/watch?v=RKNBIitoXMQ,"Business, Europe, UK, Room Service"
Iceland Beckons,es,Islandia Llama,"La tierra de nombres impronunciables y volcanes volátiles es también el hogar de impresionantes paisajes nórdicos, know-how y la singularidad de Reykjavik. Accusamus ocupan no assumenda orgánica interrumpir locavore reprehenderit. Marfa anim narval carnicero ética, tatuado dolor et esse synth probablemente no ha oído hablar de ellos 3 Luna del lobo labore Thundercats. Four Loko Blog DUI hella, aute gastropub viral Thundercats qui Pinterest. Intelectuales laboris pariatur, bushwick DIY scenester artesanal odio Kogi culpa. Ethical realidad pinterest, uf nulla moda hacha veniam profunda v adipisicing tempor granja a la mesa. Lo-fi cliché quinua semiótica vegan enim.",iceland-landscape.jpg,http://www.youtube.com/watch?v=mn3vwBsAJEo,Vacation