UUID,Info,Body
4b2d068d-8141-4d8d-8b04-4ec78770f9cc,Texto de la página de Empleados,"<p> Servir a nuestros clientes de costa a costa, el nuestro equipo en Bayside están disponibles durante 16 horas al día. Entendemos que sus preguntas no siempre surgen entre las horas de 9:00-05:00 . Estamos aquí para exceder sus expectativas. </p> <p> Operando bajo el enfoque de equipo , cada cliente tiene la posibilidad de conectarse con cualquiera de nuestro personal cuando sea necesario . </p> <p> Búsqueda de experiencia particular ? Utilice las fichas clasificadoras , a la derecha , para buscar por función de trabajo y/o ubicación </p>"
8b162d62-670e-4857-9b02-2c9191e39585,Servicios de texto,<p> Nuestros servicios están construidas alrededor de la elaboración de nuestros clientes y sus clientela increíbles experiencias de marca utilizando todo, desde la identidad de diseño de sitios web para la comercialización presencia en la web en curso para impulsar su mensaje a las masas. </p>
62b7b1d3-b8b5-4d4c-8b00-b89bc74b9d95,Promo servicio Página de inicio,"<h3> <b> Bayside Consulting </b> es el socio global de consultoría de negocios. <br/> No sólo te aconsejamos sobre qué hacer- <b> lleguemos allí. </b> </h3> <hr> <figure> <img src = ""/sites/default/files/consulting_promo.png ""> </img> <a href=""/es/servicio/asesoramiento-digital""> <h4> Digital Consulting </h4> </a> <p> Experiencias Omni-canal <br/> Digital In-store <br/>Apps móviles Websites Responsive <br/> Experiencias Emerging Technology <br/> </p> </figure> <figure> <img src = ""/sites/default/files/business_promo.png ""> </img> <a href=""/es/servicio/transformacion-de-negocios""> <h4>Transformación del negocio </h4> </a> <p> Negocios mejoradas digitalmente <br/> Empresa Estrategias digitales <br/> Contenido y Tráfico Monetización Estrategias <br/> Estrategias API Open Data <br/> </p> </figure> <figure> <img src = ""/sites/default/files/innovative_promo.png ""> </img> <a href=""/es/servicio/analisis-de-investigacion""> <h4> Análisis de Investigación </h4> </a> <p> Visualización Big Data <br/> Internet de las Cosas Industrial <br/> Centro Digital de Excelencia <br/> Digitalización Proceso Operacional <br/> Equipo-on-Demand Digital <br/> </p> </figure>"
5c8004f5-02f8-4d37-b900-f5c9bffb7c7f,Contacto pie de página,"<ul> <li> Dirección </li> <li> 201 Bayside St, San Francisco , CA</li></ul><ul><li>Press/PR</li><li>press@baysideconsulting.com</li></ul><ul><li>Social</li><li><img src = ""/sites/default/files/twitter_blue.png ""> </img> | <img src = ""/sites/default/files/facebook_blue.png ""> </img> </li> </ul>"
b0627432-8487-4844-9434-52c35d3dcbc0,Pie de página sobre,"<section> <h4> Acerca de </h4> <p> El Grupo de Consultoría de Bayside es un prominente empresa de negocios de consultoría global que ofrece servicios para ayudar a los proveedores de negocios se transforman en versiones más inteligentes , más nítidas y mejor de sí mismos . Bayside ha estado llevando a cabo su misión , proporcionando una visión de marketing estratégico , operaciones , tecnología y organización para expandir el crecimiento económico de su cliente. </p> </section> <section> <h4> Últimas Webinar </h4> <p> <b> Primavera 2015 Estrategia de Negocios </b> </p> <p> Lorem ipsum dolor sit amet, te dolor vel omittam persius . Eos ei gloriatur sententiae , ad nulla choro constituam eum . </p> </section>"
dae3d171-0009-4e45-ad00-feba17b0ccfe,Contacto Héroe,"<img src=""/sites/default/files/contact_hero.jpg""></img>"